{
  "schema_version": 1,
  "user": "karthik-vana",
  "source": {
    "type": "github-html",
    "url": "https://github.com/users/karthik-vana/contributions"
  },
  "updated_at": "2026-10-09T09:02:32Z",
  "as_of": "2026-10-09",
  "range": {
    "from": "2025-10-05",
    "to": "2026-10-09"
  },
  "reported_total": 294,
  "days": [
    {"date": "2025-10-05", "count": 0, "level": 0},
    {"date": "2025-10-06", "count": 0, "level": 0},
    {"date": "2025-10-07", "count": 0, "level": 0},
    {"date": "2025-10-08", "count": 0, "level": 0},
    {"date": "2025-10-09", "count": 0, "level": 0},
    {"date": "2025-10-10", "count": 0, "level": 0},
    {"date": "2025-10-11", "count": 0, "level": 0},
    {"date": "2025-10-12", "count": 0, "level": 0},
    {"date": "2025-10-13", "count": 0, "level": 0},
    {"date": "2025-10-14", "count": 0, "level": 0},
    {"date": "2025-10-15", "count": 0, "level": 0},
    {"date": "2025-10-16", "count": 0, "level": 0},
    {"date": "2025-10-17", "count": 0, "level": 0},
    {"date": "2025-10-18", "count": 0, "level": 0},
    {"date": "2025-10-19", "count": 0, "level": 0},
    {"date": "2025-10-20", "count": 0, "level": 0},
    {"date": "2025-10-21", "count": 0, "level": 0},
    {"date": "2025-10-22", "count": 0, "level": 0},
    {"date": "2025-10-23", "count": 0, "level": 0},
    {"date": "2025-10-24", "count": 0, "level": 0},
    {"date": "2025-10-25", "count": 8, "level": 4},
    {"date": "2025-10-26", "count": 8, "level": 4},
    {"date": "2025-10-27", "count": 0, "level": 0},
    {"date": "2025-10-28", "count": 0, "level": 0},
    {"date": "2025-10-29", "count": 0, "level": 0},
    {"date": "2025-10-30", "count": 40, "level": 4},
    {"date": "2025-10-31", "count": 0, "level": 0},
    {"date": "2025-11-01", "count": 0, "level": 0},
    {"date": "2025-11-02", "count": 0, "level": 0},
    {"date": "2025-11-03", "count": 0, "level": 0},
    {"date": "2025-11-04", "count": 0, "level": 0},
    {"date": "2025-11-05", "count": 0, "level": 0},
    {"date": "2025-11-06", "count": 0, "level": 0},
    {"date": "2025-11-07", "count": 0, "level": 0},
    {"date": "2025-11-08", "count": 9, "level": 4},
    {"date": "2025-11-09", "count": 0, "level": 0},
    {"date": "2025-11-10", "count": 0, "level": 0},
    {"date": "2025-11-11", "count": 0, "level": 0},
    {"date": "2025-11-12", "count": 0, "level": 0},
    {"date": "2025-11-13", "count": 0, "level": 0},
    {"date": "2025-11-14", "count": 0, "level": 0},
    {"date": "2025-11-15", "count": 0, "level": 0},
    {"date": "2025-11-16", "count": 0, "level": 0},
    {"date": "2025-11-17", "count": 0, "level": 0},
    {"date": "2025-11-18", "count": 0, "level": 0},
    {"date": "2025-11-19", "count": 0, "level": 0},
    {"date": "2025-11-20", "count": 0, "level": 0},
    {"date": "2025-11-21", "count": 0, "level": 0},
    {"date": "2025-11-22", "count": 0, "level": 0},
    {"date": "2025-11-23", "count": 0, "level": 0},
    {"date": "2025-11-24", "count": 0, "level": 0},
    {"date": "2025-11-25", "count": 0, "level": 0},
    {"date": "2025-11-26", "count": 0, "level": 0},
    {"date": "2025-11-27", "count": 0, "level": 0},
    {"date": "2025-11-28", "count": 0, "level": 0},
    {"date": "2025-11-29", "count": 0, "level": 0},
    {"date": "2025-11-30", "count": 0, "level": 0},
    {"date": "2025-12-01", "count": 0, "level": 0},
    {"date": "2025-12-02", "count": 3, "level": 2},
    {"date": "2025-12-03", "count": 5, "level": 2},
    {"date": "2025-12-04", "count": 3, "level": 2},
    {"date": "2025-12-05", "count": 0, "level": 0},
    {"date": "2025-12-06", "count": 0, "level": 0},
    {"date": "2025-12-07", "count": 16, "level": 4},
    {"date": "2025-12-08", "count": 4, "level": 2},
    {"date": "2025-12-09", "count": 1, "level": 1},
    {"date": "2025-12-10", "count": 0, "level": 0},
    {"date": "2025-12-11", "count": 0, "level": 0},
    {"date": "2025-12-12", "count": 0, "level": 0},
    {"date": "2025-12-13", "count": 0, "level": 0},
    {"date": "2025-12-14", "count": 1, "level": 1},
    {"date": "2025-12-15", "count": 0, "level": 0},
    {"date": "2025-12-16", "count": 1, "level": 1},
    {"date": "2025-12-17", "count": 7, "level": 3},
    {"date": "2025-12-18", "count": 1, "level": 1},
    {"date": "2025-12-19", "count": 0, "level": 0},
    {"date": "2025-12-20", "count": 0, "level": 0},
    {"date": "2025-12-21", "count": 6, "level": 3},
    {"date": "2025-12-22", "count": 0, "level": 0},
    {"date": "2025-12-23", "count": 10, "level": 4},
    {"date": "2025-12-24", "count": 0, "level": 0},
    {"date": "2025-12-25", "count": 0, "level": 0},
    {"date": "2025-12-26", "count": 0, "level": 0},
    {"date": "2025-12-27", "count": 1, "level": 1},
    {"date": "2025-12-28", "count": 5, "level": 2},
    {"date": "2025-12-29", "count": 7, "level": 3},
    {"date": "2025-12-30", "count": 4, "level": 2},
    {"date": "2025-12-31", "count": 0, "level": 0},
    {"date": "2026-01-01", "count": 4, "level": 2},
    {"date": "2026-01-02", "count": 1, "level": 1},
    {"date": "2026-01-03", "count": 0, "level": 0},
    {"date": "2026-01-04", "count": 0, "level": 0},
    {"date": "2026-01-05", "count": 0, "level": 0},
    {"date": "2026-01-06", "count": 0, "level": 0},
    {"date": "2026-01-07", "count": 0, "level": 0},
    {"date": "2026-01-08", "count": 0, "level": 0},
    {"date": "2026-01-09", "count": 0, "level": 0},
    {"date": "2026-01-10", "count": 0, "level": 0},
    {"date": "2026-01-11", "count": 0, "level": 0},
    {"date": "2026-01-12", "count": 0, "level": 0},
    {"date": "2026-01-13", "count": 0, "level": 0},
    {"date": "2026-01-14", "count": 0, "level": 0},
    {"date": "2026-01-15", "count": 0, "level": 0},
    {"date": "2026-01-16", "count": 0, "level": 0},
    {"date": "2026-01-17", "count": 0, "level": 0},
    {"date": "2026-01-18", "count": 0, "level": 0},
    {"date": "2026-01-19", "count": 0, "level": 0},
    {"date": "2026-01-20", "count": 9, "level": 4},
    {"date": "2026-01-21", "count": 1, "level": 1},
    {"date": "2026-01-22", "count": 0, "level": 0},
    {"date": "2026-01-23", "count": 0, "level": 0},
    {"date": "2026-01-24", "count": 0, "level": 0},
    {"date": "2026-01-25", "count": 0, "level": 0},
    {"date": "2026-01-26", "count": 1, "level": 1},
    {"date": "2026-01-27", "count": 2, "level": 1},
    {"date": "2026-01-28", "count": 3, "level": 2},
    {"date": "2026-01-29", "count": 1, "level": 1},
    {"date": "2026-01-30", "count": 5, "level": 2},
    {"date": "2026-01-31", "count": 7, "level": 3},
    {"date": "2026-02-01", "count": 30, "level": 4},
    {"date": "2026-02-02", "count": 0, "level": 0},
    {"date": "2026-02-03", "count": 10, "level": 4},
    {"date": "2026-02-04", "count": 7, "level": 3},
    {"date": "2026-02-05", "count": 2, "level": 1},
    {"date": "2026-02-06", "count": 5, "level": 2},
    {"date": "2026-02-07", "count": 3, "level": 2},
    {"date": "2026-02-08", "count": 0, "level": 0},
    {"date": "2026-02-09", "count": 0, "level": 0},
    {"date": "2026-02-10", "count": 0, "level": 0},
    {"date": "2026-02-11", "count": 0, "level": 0},
    {"date": "2026-02-12", "count": 0, "level": 0},
    {"date": "2026-02-13", "count": 0, "level": 0},
    {"date": "2026-02-14", "count": 0, "level": 0},
    {"date": "2026-02-15", "count": 0, "level": 0},
    {"date": "2026-02-16", "count": 1, "level": 1},
    {"date": "2026-02-17", "count": 0, "level": 0},
    {"date": "2026-02-18", "count": 0, "level": 0},
    {"date": "2026-02-19", "count": 0, "level": 0},
    {"date": "2026-02-20", "count": 0, "level": 0},
    {"date": "2026-02-21", "count": 0, "level": 0},
    {"date": "2026-02-22", "count": 0, "level": 0},
    {"date": "2026-02-23", "count": 0, "level": 0},
    {"date": "2026-02-24", "count": 0, "level": 0},
    {"date": "2026-02-25", "count": 0, "level": 0},
    {"date": "2026-02-26", "count": 0, "level": 0},
    {"date": "2026-02-27", "count": 0, "level": 0},
    {"date": "2026-02-28", "count": 0, "level": 0},
    {"date": "2026-03-01", "count": 0, "level": 0},
    {"date": "2026-03-02", "count": 2, "level": 1},
    {"date": "2026-03-03", "count": 2, "level": 1},
    {"date": "2026-03-04", "count": 0, "level": 0},
    {"date": "2026-03-05", "count": 0, "level": 0},
    {"date": "2026-03-06", "count": 0, "level": 0},
    {"date": "2026-03-07", "count": 0, "level": 0},
    {"date": "2026-03-08", "count": 0, "level": 0},
    {"date": "2026-03-09", "count": 2, "level": 1},
    {"date": "2026-03-10", "count": 0, "level": 0},
    {"date": "2026-03-11", "count": 0, "level": 0},
    {"date": "2026-03-12", "count": 0, "level": 0},
    {"date": "2026-03-13", "count": 0, "level": 0},
    {"date": "2026-03-14", "count": 2, "level": 1},
    {"date": "2026-03-15", "count": 0, "level": 0},
    {"date": "2026-03-16", "count": 0, "level": 0},
    {"date": "2026-03-17", "count": 0, "level": 0},
    {"date": "2026-03-18", "count": 0, "level": 0},
    {"date": "2026-03-19", "count": 0, "level": 0},
    {"date": "2026-03-20", "count": 0, "level": 0},
    {"date": "2026-03-21", "count": 0, "level": 0},
    {"date": "2026-03-22", "count": 5, "level": 2},
    {"date": "2026-03-23", "count": 1, "level": 1},
    {"date": "2026-03-24", "count": 0, "level": 0},
    {"date": "2026-03-25", "count": 1, "level": 1},
    {"date": "2026-03-26", "count": 6, "level": 3},
    {"date": "2026-03-27", "count": 1, "level": 1},
    {"date": "2026-03-28", "count": 0, "level": 0},
    {"date": "2026-03-29", "count": 0, "level": 0},
    {"date": "2026-03-30", "count": 0, "level": 0},
    {"date": "2026-03-31", "count": 0, "level": 0},
    {"date": "2026-04-01", "count": 0, "level": 0},
    {"date": "2026-04-02", "count": 0, "level": 0},
    {"date": "2026-04-03", "count": 0, "level": 0},
    {"date": "2026-04-04", "count": 0, "level": 0},
    {"date": "2026-04-05", "count": 0, "level": 0},
    {"date": "2026-04-06", "count": 0, "level": 0},
    {"date": "2026-04-07", "count": 0, "level": 0},